{
 "chain_id": "BN-REAL-REPEAT-s3",
 "generation": 6,
 "language": "BN",
 "regime": "REAL-REPEAT",
 "variant": "control_seed3",
 "session_id": "rented-1792808389",
 "seed": 20263016,
 "seed_offset": 2000,
 "gen0_id": "GEN0-BN-s3",
 "budget_tokens": 10000000,
 "sampling": {
  "temperature": 1.0,
  "top_p": 1.0
 },
 "training_set": {
  "real_docs": 20913,
  "synthetic_docs": 0,
  "components": [
   "seed"
  ],
  "tokens": 10039296,
  "target_tokens": 9997831,
  "real_target_tokens": 9997831,
  "synthetic_target_tokens": 0,
  "masked_prefix_tokens": 0
 },
 "generate": null,
 "filter": null,
 "train": {
  "train_blocks": 9804,
  "train_tokens": 10039296,
  "target_tokens": 9997831,
  "real_target_tokens": 9997831,
  "synthetic_target_tokens": 0,
  "masked_prefix_tokens": 0,
  "real_docs": 20913,
  "synthetic_docs": 0,
  "prefix_mode": "masked",
  "bos_per_document": true,
  "eos_target_docs": 17720,
  "eos_context_only_docs": 3193,
  "final_loss": 2.4157392501831056,
  "loss_first": 2.351679229736328,
  "loss_curve": [
   2.351679229736328,
   2.4971967697143556,
   2.4805089950561525,
   2.510081100463867,
   2.477025032043457,
   2.4114824295043946,
   2.4157392501831056
  ],
  "nan": false,
  "train_seconds": 594.1,
  "optimizer_steps": 154,
  "micro_batch_seqs": 4,
  "grad_accum_steps": 16,
  "effective_batch_seqs": 64,
  "warmup": {
   "warmup_steps": 0.03
  },
  "dtype": "bfloat16",
  "save_dtype": "bfloat16",
  "trainer_metrics": {
   "train_runtime": 593.5586,
   "train_samples_per_second": 16.517,
   "train_steps_per_second": 0.259,
   "total_flos": 6043215426748416.0,
   "train_loss": 2.442018781389509,
   "epoch": 1.0
  }
 },
 "sample": {
  "engine": "vllm",
  "docs": 2000,
  "tokens": 546459,
  "generate_seconds": 55.1,
  "seed": 20263023,
  "start_index": 0,
  "gpu_memory_utilization": 0.85,
  "sampling": {
   "temperature": 1.0,
   "top_p": 1.0
  },
  "max_docs": 2000,
  "prefix_subset": 2000,
  "prefix_tokens": 21,
  "max_new_tokens": 338,
  "exact_duplicate_rate": 0.0,
  "mean_tokens": 273.23,
  "mean_words": 155.92,
  "mean_chars": 1037.71,
  "mean_bytes": 2767.35,
  "cap_hit_rate": 0.592,
  "empty_rate": 0.0
 },
 "checkpoint_sha256": "c4e0b69d91a962f131d38523cbe5929b536aff8df8913dacc99c55654ccb33af",
 "previous_checkpoint": "/workspace/CG4/results/chains/BN-REAL-REPEAT-s3/gen_5/checkpoint",
 "created_at": "2026-10-24T09:36:17+00:00"
}